{
  "schemaType": "thread_output",
  "id": "example-sales-tips-2026-06-30",
  "title": "Example Sales Tips Handoff",
  "sourceThread": {
    "name": "Sales Tips",
    "slug": "sales-tips",
    "threadId": "019f18ba-c18c-7762-8aec-f4c6e9851030"
  },
  "targetAgents": ["sales", "executive"],
  "createdAt": "2026-06-30T00:00:00.000Z",
  "status": "pending_review",
  "confidence": "medium",
  "summary": "Example local-only recommendation for prioritizing first sales targets.",
  "findings": ["The CRM is ready for local planning, but target data still needs review."],
  "recommendations": [
    {
      "title": "Review first target list",
      "detail": "Use the Sales Agent to rank MMA gyms, CrossFit boxes, and small gyms before outreach.",
      "priority": "medium"
    }
  ],
  "safety": {
    "externalActions": "none",
    "productionWrites": false,
    "secretsIncluded": false,
    "notes": ["Example payload only. No emails, CRM writes, Stripe writes, or production writes."]
  }
}
